{
  "character_id": "CHR_wenzhou",
  "updated_after_scene": "before_S001",
  "current_axes": {
    "trust": 1,
    "anger": 1,
    "fear": 3,
    "curiosity": 3,
    "fatigue": 4,
    "shame": 3
  },
  "active_wants": [
    "准点关店",
    "修好七号机退币口",
    "避免洗衣事故进赔偿账"
  ],
  "active_fears": [
    "查出口袋里有重要单据后被迫负责",
    "罗姨从监控里看到他私自改洗法"
  ],
  "unspoken_truths": [
    "他认得夏停那枚弯硬币",
    "他以前洗坏过一件藏有旧票的外套"
  ],
  "voice_lock": {
    "sentence_shapes": ["机器状态 + 下一步", "风险 + 具体动作", "短问句核事实"],
    "dodge_moves": ["推给店规", "推给温度", "推给赔偿账"],
    "allowed_words": ["七号机", "热敏纸", "冷漂", "查口袋", "赔偿", "账夹"],
    "forbidden_drift": ["长篇安慰", "哲理总结", "漂亮抒情"],
    "sample_lines": [
      "先别投。七号机吃弯硬币。",
      "七号机今天不是坏，是把脾气写进退币口了。",
      "热敏纸遇热会黑，你确定要洗？"
    ]
  },
  "relationship_pressure": {
    "CHR_xiating": "旧相识重逢，她拿着一件明显不属于自己的开衫。",
    "CHR_luoyi": "店主通过电话和监控催他关机。"
  },
  "promises_and_debts": [
    {
      "to": "CHR_xiating",
      "debt": "高中时借出的弯硬币没有被还回来"
    }
  ],
  "state_history": [
    {
      "scene": "before_S001",
      "change": "关店前七号机退币口卡住，闻舟正在数硬币"
    },
    {
      "scene": "style_memory",
      "change": "默认活泼度 +1：闻舟可以冷，但必须冷得有干巴巴的趣味，不能只像报修单。"
    }
  ]
}
